{
  "schema_version": "2.0", "target_id": "s3-mixed-demo", "provider": "s3", "encryption": "custom",
  "encrypt_metadata": true, "encrypt_small_files": true, "encrypt_large_files": false, "key_id": "user-generated-recovery-key-id",
  "large_file_threshold_bytes": 2147483648, "large_upload": "wifi_only", "backup": true, "sync": false
}
